{
  "schema_version": 1,
  "slug": "uci-abalone",
  "row_count": 4177,
  "parquet_sha256": "a53bc5f369c9d03a0acc0188c0daf79207f4af8d0e9e2ca3f2a9da350680cefb",
  "computed_at": "2026-05-16T10:21:41Z",
  "sample_rows": null,
  "columns": {
    "sex": {
      "null_count": 0,
      "ndv_approx": 3,
      "mean_length": 1.0,
      "top_values": [
        {
          "value": "M",
          "count": 1528
        },
        {
          "value": "I",
          "count": 1342
        },
        {
          "value": "F",
          "count": 1307
        }
      ],
      "dtype": "string"
    },
    "length": {
      "null_count": 0,
      "min": 0.075,
      "max": 0.815,
      "mean": 0.5239920995930099,
      "ndv_approx": 134,
      "histogram": {
        "buckets": [
          0.075,
          0.149,
          0.22299999999999998,
          0.297,
          0.371,
          0.445,
          0.5189999999999999,
          0.593,
          0.6669999999999999,
          0.7409999999999999,
          0.815
        ],
        "counts": [
          7,
          60,
          147,
          304,
          460,
          778,
          1051,
          1017,
          324,
          29
        ]
      },
      "dtype": "float64"
    },
    "diameter": {
      "null_count": 0,
      "min": 0.055,
      "max": 0.65,
      "mean": 0.407881254488869,
      "ndv_approx": 125,
      "histogram": {
        "buckets": [
          0.055,
          0.11449999999999999,
          0.174,
          0.23349999999999999,
          0.293,
          0.3525,
          0.412,
          0.4715,
          0.531,
          0.5905,
          0.65
        ],
        "counts": [
          13,
          66,
          180,
          344,
          513,
          812,
          1017,
          934,
          275,
          23
        ]
      },
      "dtype": "float64"
    },
    "height": {
      "null_count": 0,
      "min": 0.0,
      "max": 1.13,
      "mean": 0.1395163993296614,
      "ndv_approx": 47,
      "histogram": {
        "buckets": [
          0.0,
          0.11299999999999999,
          0.22599999999999998,
          0.33899999999999997,
          0.45199999999999996,
          0.565,
          0.6779999999999999,
          0.7909999999999999,
          0.9039999999999999,
          1.017,
          1.13
        ],
        "counts": [
          1023,
          3129,
          23,
          0,
          1,
          0,
          0,
          0,
          0,
          1
        ]
      },
      "dtype": "float64"
    },
    "whole_weight": {
      "null_count": 0,
      "min": 0.002,
      "max": 2.8255,
      "mean": 0.82874215944458,
      "ndv_approx": 2061,
      "histogram": {
        "buckets": [
          0.002,
          0.28435,
          0.5667,
          0.84905,
          1.1314,
          1.41375,
          1.6961,
          1.9784499999999998,
          2.2607999999999997,
          2.54315,
          2.8255
        ],
        "counts": [
          632,
          783,
          827,
          824,
          616,
          286,
          129,
          58,
          16,
          6
        ]
      },
      "dtype": "float64"
    },
    "shucked_weight": {
      "null_count": 0,
      "min": 0.001,
      "max": 1.488,
      "mean": 0.35936748862820106,
      "ndv_approx": 1711,
      "histogram": {
        "buckets": [
          0.001,
          0.1497,
          0.2984,
          0.4471,
          0.5958,
          0.7445,
          0.8932,
          1.0418999999999998,
          1.1905999999999999,
          1.3393,
          1.488
        ],
        "counts": [
          786,
          1052,
          962,
          775,
          399,
          123,
          46,
          24,
          7,
          3
        ]
      },
      "dtype": "float64"
    },
    "viscera_weight": {
      "null_count": 0,
      "min": 0.0005,
      "max": 0.76,
      "mean": 0.18059360785252604,
      "ndv_approx": 980,
      "histogram": {
        "buckets": [
          0.0005,
          0.07645,
          0.1524,
          0.22835,
          0.3043,
          0.38025000000000003,
          0.4562,
          0.53215,
          0.6081,
          0.6840499999999999,
          0.76
        ],
        "counts": [
          835,
          999,
          1027,
          747,
          363,
          147,
          50,
          7,
          1,
          1
        ]
      },
      "dtype": "float64"
    },
    "shell_weight": {
      "null_count": 0,
      "min": 0.0015,
      "max": 1.005,
      "mean": 0.23883085946851795,
      "ndv_approx": 1091,
      "histogram": {
        "buckets": [
          0.0015,
          0.10184999999999998,
          0.20219999999999996,
          0.30254999999999993,
          0.4028999999999999,
          0.5032499999999999,
          0.6035999999999998,
          0.7039499999999999,
          0.8042999999999998,
          0.9046499999999997,
          1.005
        ],
        "counts": [
          777,
          1023,
          1078,
          798,
          349,
          104,
          33,
          9,
          5,
          1
        ]
      },
      "dtype": "float64"
    },
    "rings": {
      "null_count": 0,
      "min": 1,
      "max": 29,
      "mean": 9.933684462532918,
      "ndv_approx": 27,
      "histogram": {
        "buckets": [
          1.0,
          3.8,
          6.6,
          9.399999999999999,
          12.2,
          15.0,
          17.799999999999997,
          20.599999999999998,
          23.4,
          26.2,
          29.0
        ],
        "counts": [
          17,
          431,
          1648,
          1388,
          329,
          228,
          100,
          29,
          4,
          3
        ]
      },
      "dtype": "uint8"
    }
  }
}
