{
  "schema_version": 1,
  "slug": "uci-energy-efficiency",
  "row_count": 768,
  "parquet_sha256": "a648839d477319e278edd9f46a488d941503993c10f928a732659c86f1a4d874",
  "computed_at": "2026-05-16T10:22:53Z",
  "sample_rows": null,
  "columns": {
    "x1": {
      "null_count": 0,
      "min": 0.62,
      "max": 0.98,
      "mean": 0.7641666666666677,
      "ndv_approx": 11,
      "histogram": {
        "buckets": [
          0.62,
          0.656,
          0.692,
          0.728,
          0.764,
          0.8,
          0.836,
          0.872,
          0.9079999999999999,
          0.944,
          0.98
        ],
        "counts": [
          128,
          128,
          64,
          128,
          64,
          64,
          64,
          64,
          0,
          64
        ]
      },
      "dtype": "float64"
    },
    "x2": {
      "null_count": 0,
      "min": 514.5,
      "max": 808.5,
      "mean": 671.7083333333334,
      "ndv_approx": 12,
      "histogram": {
        "buckets": [
          514.5,
          543.9,
          573.3,
          602.7,
          632.1,
          661.5,
          690.9,
          720.3,
          749.7,
          779.0999999999999,
          808.5
        ],
        "counts": [
          64,
          64,
          64,
          64,
          64,
          128,
          64,
          64,
          64,
          128
        ]
      },
      "dtype": "float64"
    },
    "x3": {
      "null_count": 0,
      "min": 245.0,
      "max": 416.5,
      "mean": 318.5,
      "ndv_approx": 5,
      "histogram": {
        "buckets": [
          245.0,
          262.15,
          279.3,
          296.45,
          313.6,
          330.75,
          347.9,
          365.04999999999995,
          382.2,
          399.35,
          416.5
        ],
        "counts": [
          64,
          64,
          192,
          0,
          192,
          128,
          0,
          64,
          0,
          64
        ]
      },
      "dtype": "float64"
    },
    "x4": {
      "null_count": 0,
      "min": 110.25,
      "max": 220.5,
      "mean": 176.60416666666666,
      "ndv_approx": 4,
      "histogram": {
        "buckets": [
          110.25,
          121.275,
          132.3,
          143.325,
          154.35,
          165.375,
          176.4,
          187.425,
          198.45,
          209.47500000000002,
          220.5
        ],
        "counts": [
          64,
          128,
          0,
          192,
          0,
          0,
          0,
          0,
          0,
          384
        ]
      },
      "dtype": "float64"
    },
    "x5": {
      "null_count": 0,
      "min": 3.5,
      "max": 7.0,
      "mean": 5.25,
      "ndv_approx": 2,
      "histogram": {
        "buckets": [
          3.5,
          3.85,
          4.2,
          4.55,
          4.9,
          5.25,
          5.6,
          5.949999999999999,
          6.3,
          6.65,
          7.0
        ],
        "counts": [
          384,
          0,
          0,
          0,
          0,
          0,
          0,
          0,
          0,
          384
        ]
      },
      "dtype": "float64"
    },
    "x6": {
      "null_count": 0,
      "min": 2,
      "max": 5,
      "mean": 3.5,
      "ndv_approx": 4,
      "histogram": {
        "buckets": [
          2.0,
          2.3,
          2.6,
          2.9,
          3.2,
          3.5,
          3.8,
          4.1,
          4.4,
          4.699999999999999,
          5.0
        ],
        "counts": [
          192,
          0,
          0,
          192,
          0,
          0,
          192,
          0,
          0,
          192
        ]
      },
      "dtype": "uint8"
    },
    "x7": {
      "null_count": 0,
      "min": 0.0,
      "max": 0.4,
      "mean": 0.23437500000000186,
      "ndv_approx": 4,
      "histogram": {
        "buckets": [
          0.0,
          0.04,
          0.08,
          0.12,
          0.16,
          0.2,
          0.24,
          0.28,
          0.32,
          0.36,
          0.4
        ],
        "counts": [
          48,
          0,
          240,
          0,
          0,
          0,
          240,
          0,
          0,
          240
        ]
      },
      "dtype": "float64"
    },
    "x8": {
      "null_count": 0,
      "min": 0,
      "max": 5,
      "mean": 2.8125,
      "ndv_approx": 6,
      "histogram": {
        "buckets": [
          0.0,
          0.5,
          1.0,
          1.5,
          2.0,
          2.5,
          3.0,
          3.5,
          4.0,
          4.5,
          5.0
        ],
        "counts": [
          48,
          0,
          144,
          0,
          144,
          0,
          144,
          0,
          144,
          144
        ]
      },
      "dtype": "uint8"
    },
    "y1": {
      "null_count": 0,
      "min": 6.01,
      "max": 43.1,
      "mean": 22.307200520833305,
      "ndv_approx": 670,
      "histogram": {
        "buckets": [
          6.01,
          9.719000000000001,
          13.428,
          17.137,
          20.846000000000004,
          24.555,
          28.264000000000003,
          31.973000000000006,
          35.682,
          39.391000000000005,
          43.1
        ],
        "counts": [
          20,
          187,
          153,
          39,
          39,
          59,
          83,
          83,
          59,
          46
        ]
      },
      "dtype": "float64"
    },
    "y2": {
      "null_count": 0,
      "min": 10.9,
      "max": 48.03,
      "mean": 24.58776041666671,
      "ndv_approx": 516,
      "histogram": {
        "buckets": [
          10.9,
          14.613,
          18.326,
          22.039,
          25.752000000000002,
          29.465000000000003,
          33.178,
          36.891,
          40.604,
          44.317,
          48.03
        ],
        "counts": [
          118,
          204,
          61,
          29,
          73,
          94,
          98,
          56,
          21,
          14
        ]
      },
      "dtype": "float64"
    }
  }
}
