{
  "schema_version": 1,
  "slug": "google-cluster-trace-2011-machine-events",
  "row_count": 37780,
  "parquet_sha256": "fd894bd09380724d679cb64a8e713891d233d50cca2522216323ae91058d9d32",
  "computed_at": "2026-05-13T16:44:37Z",
  "sample_rows": null,
  "columns": {
    "f0": {
      "null_count": 0,
      "min": 0,
      "max": 2506135493517,
      "mean": 871708710684.7107,
      "ndv_approx": 24724,
      "histogram": {
        "buckets": [
          0.0,
          250613549351.7,
          501227098703.4,
          751840648055.1001,
          1002454197406.8,
          1253067746758.5,
          1503681296110.2002,
          1754294845461.9001,
          2004908394813.6,
          2255521944165.3003,
          2506135493517.0
        ],
        "counts": [
          15074,
          2205,
          1894,
          2639,
          2139,
          2791,
          2961,
          2570,
          3286,
          2221
        ]
      },
      "dtype": "uint64"
    },
    "f1": {
      "null_count": 0,
      "min": 5,
      "max": 6457070948,
      "mean": 1375693985.7969825,
      "ndv_approx": 13434,
      "histogram": {
        "buckets": [
          5.0,
          645707099.3,
          1291414193.6,
          1937121287.8999999,
          2582828382.2,
          3228535476.5,
          3874242570.7999997,
          4519949665.099999,
          5165656759.4,
          5811363853.7,
          6457070948.0
        ],
        "counts": [
          21960,
          1908,
          2979,
          1400,
          1236,
          2219,
          3220,
          2192,
          274,
          392
        ]
      },
      "dtype": "uint64"
    },
    "f2": {
      "null_count": 0,
      "min": 0,
      "max": 2,
      "mean": 0.6277660137638963,
      "ndv_approx": 3,
      "histogram": {
        "buckets": [
          0.0,
          0.2,
          0.4,
          0.6000000000000001,
          0.8,
          1.0,
          1.2000000000000002,
          1.4000000000000001,
          1.6,
          1.8,
          2.0
        ],
        "counts": [
          21443,
          0,
          0,
          0,
          0,
          8957,
          0,
          0,
          0,
          7380
        ]
      },
      "dtype": "uint8"
    },
    "f3": {
      "null_count": 0,
      "ndv_approx": 4,
      "mean_length": 44.0,
      "top_values": [
        {
          "value": "HofLGzk1Or/8Ildj2+Lqv0UGGvY82NLoni8+J/Yy0RU=",
          "count": 35015
        },
        {
          "value": "GtXakjpd0CD41brK7k/27s3Eby3RpJKy7taB9S8UQRA=",
          "count": 2223
        },
        {
          "value": "70ZOvysYGtB6j9MUHMPzA2Iy7GRzWeJTdX0YCLRKGVg=",
          "count": 510
        },
        {
          "value": "JQ1tVQBMHBAIISU1gUNXk2powhYumYA+4cB3KzU29l8=",
          "count": 32
        }
      ],
      "dtype": "string"
    },
    "f4": {
      "null_count": 32,
      "min": 0.25,
      "max": 1.0,
      "mean": 0.5260676062307937,
      "ndv_approx": 3,
      "histogram": {
        "buckets": [
          0.25,
          0.325,
          0.4,
          0.475,
          0.55,
          0.625,
          0.7,
          0.775,
          0.85,
          0.9249999999999999,
          1.0
        ],
        "counts": [
          510,
          0,
          0,
          35015,
          0,
          0,
          0,
          0,
          0,
          2223
        ]
      },
      "dtype": "float64"
    },
    "f5": {
      "null_count": 32,
      "min": 0.03085,
      "max": 1.0,
      "mean": 0.4767365169015281,
      "ndv_approx": 10,
      "histogram": {
        "buckets": [
          0.03085,
          0.127765,
          0.22468,
          0.321595,
          0.41851,
          0.515425,
          0.6123400000000001,
          0.7092550000000001,
          0.80617,
          0.903085,
          1.0
        ],
        "counts": [
          106,
          0,
          10698,
          0,
          21736,
          0,
          0,
          2983,
          0,
          2225
        ]
      },
      "dtype": "float64"
    }
  }
}
