{
  "schema_version": 1,
  "slug": "stackoverflow-posts",
  "row_count": 58329355,
  "parquet_sha256": "d21809218f2beabb2855ad331cc5410fb63210e34d8064f1c6fc451c0e0b6cd7",
  "computed_at": "2026-05-17T07:34:42Z",
  "sample_rows": null,
  "columns": {
    "Id": {
      "null_count": 0,
      "min": 4,
      "max": 75640482,
      "mean": 36958955.45140798,
      "ndv_approx": 65042643,
      "histogram": {
        "buckets": [
          4.0,
          7564051.8,
          15128099.6,
          22692147.4,
          30256195.2,
          37820243.0,
          45384290.8,
          52948338.6,
          60512386.4,
          68076434.2,
          75640482.0
        ],
        "counts": [
          6207748,
          6231150,
          5991579,
          5870491,
          5897534,
          5776451,
          5663109,
          5659622,
          5398216,
          5633455
        ]
      },
      "dtype": "uint32"
    },
    "PostTypeId": {
      "null_count": 0,
      "min": 1,
      "max": 8,
      "mean": 1.6012799215763658,
      "ndv_approx": 9,
      "histogram": {
        "buckets": [
          1.0,
          1.7,
          2.4,
          3.0999999999999996,
          3.8,
          4.5,
          5.199999999999999,
          5.8999999999999995,
          6.6,
          7.3,
          8.0
        ],
        "counts": [
          23536500,
          34681205,
          167,
          0,
          55565,
          55563,
          0,
          348,
          5,
          2
        ]
      },
      "dtype": "uint8"
    },
    "AcceptedAnswerId": {
      "null_count": 46355778,
      "min": 7,
      "max": 75640403,
      "mean": 35228573.93209264,
      "ndv_approx": 10876714,
      "histogram": {
        "buckets": [
          7.0,
          7564046.6,
          15128086.2,
          22692125.799999997,
          30256165.4,
          37820205.0,
          45384244.599999994,
          52948284.199999996,
          60512323.8,
          68076363.39999999,
          75640403.0
        ],
        "counts": [
          1351689,
          1470402,
          1296766,
          1267084,
          1220275,
          1162715,
          1120383,
          1098007,
          1054053,
          932203
        ]
      },
      "dtype": "uint32"
    },
    "ParentId": {
      "null_count": 23648150,
      "min": 4,
      "max": 75640464,
      "mean": 33271005.675794426,
      "ndv_approx": 17957118,
      "histogram": {
        "buckets": [
          4.0,
          7564050.0,
          15128096.0,
          22692142.0,
          30256188.0,
          37820234.0,
          45384280.0,
          52948326.0,
          60512372.0,
          68076418.0,
          75640464.0
        ],
        "counts": [
          5133197,
          4283563,
          3840152,
          3513833,
          3433657,
          3269088,
          3099404,
          2986685,
          2687238,
          2434388
        ]
      },
      "dtype": "uint32"
    },
    "Score": {
      "null_count": 0,
      "min": -208,
      "max": 34587,
      "mean": 2.7810038016021266,
      "ndv_approx": 3246,
      "histogram": {
        "buckets": [
          -208.0,
          3271.5,
          6751.0,
          10230.5,
          13710.0,
          17189.5,
          20669.0,
          24148.5,
          27628.0,
          31107.5,
          34587.0
        ],
        "counts": [
          58328792,
          447,
          81,
          22,
          4,
          4,
          0,
          3,
          1,
          1
        ]
      },
      "dtype": "int32"
    },
    "ViewCount": {
      "null_count": 34792855,
      "min": 1,
      "max": 12425542,
      "mean": 2921.6278466636927,
      "ndv_approx": 157235,
      "histogram": {
        "buckets": [
          1.0,
          1242555.1,
          2485109.2,
          3727663.3000000003,
          4970217.4,
          6212771.5,
          7455325.600000001,
          8697879.700000001,
          9940433.8,
          11182987.9,
          12425542.0
        ],
        "counts": [
          23535168,
          1054,
          183,
          60,
          20,
          5,
          4,
          3,
          1,
          2
        ]
      },
      "dtype": "uint32"
    },
    "Body": {
      "null_count": 0,
      "ndv_approx": 50478849,
      "mean_length": 994.1107216255006,
      "top_values": null,
      "dtype": "string"
    },
    "Title": {
      "null_count": 34790338,
      "ndv_approx": 31304429,
      "mean_length": 54.80977625361331,
      "top_values": null,
      "dtype": "string"
    },
    "ContentLicense": {
      "null_count": 0,
      "ndv_approx": 3,
      "mean_length": 12.0,
      "top_values": [
        {
          "value": "CC BY-SA 3.0",
          "count": 34598931
        },
        {
          "value": "CC BY-SA 4.0",
          "count": 19637642
        },
        {
          "value": "CC BY-SA 2.5",
          "count": 4092782
        }
      ],
      "dtype": "string"
    },
    "FavoriteCount": {
      "null_count": 53300709,
      "min": 0,
      "max": 225,
      "mean": 7.874883219061354e-05,
      "ndv_approx": 5,
      "histogram": {
        "buckets": [
          0.0,
          22.5,
          45.0,
          67.5,
          90.0,
          112.5,
          135.0,
          157.5,
          180.0,
          202.5,
          225.0
        ],
        "counts": [
          5028644,
          1,
          0,
          0,
          0,
          0,
          0,
          0,
          0,
          1
        ]
      },
      "dtype": "uint8"
    },
    "CreationDate": {
      "null_count": 0,
      "ndv_approx": 53323248,
      "mean_length": 23.0,
      "top_values": null,
      "dtype": "string"
    },
    "LastActivityDate": {
      "null_count": 0,
      "ndv_approx": 38962959,
      "mean_length": 23.0,
      "top_values": null,
      "dtype": "string"
    },
    "LastEditDate": {
      "null_count": 34649768,
      "ndv_approx": 18885846,
      "mean_length": 23.0,
      "top_values": null,
      "dtype": "string"
    },
    "LastEditorUserId": {
      "null_count": 34959273,
      "min": -1,
      "max": 21334684,
      "mean": 3313385.8998638946,
      "ndv_approx": 2433033,
      "histogram": {
        "buckets": [
          -1.0,
          2133467.5,
          4266936.0,
          6400404.5,
          8533873.0,
          10667341.5,
          12800810.0,
          14934278.5,
          17067747.0,
          19201215.5,
          21334684.0
        ],
        "counts": [
          12900527,
          3821709,
          2548285,
          1442873,
          969797,
          693614,
          461568,
          244577,
          157049,
          130083
        ]
      },
      "dtype": "int32"
    },
    "OwnerUserId": {
      "null_count": 859130,
      "min": -1,
      "max": 21334857,
      "mean": 4094722.393436253,
      "ndv_approx": 5918174,
      "histogram": {
        "buckets": [
          -1.0,
          2133484.8,
          4266970.6,
          6400456.399999999,
          8533942.2,
          10667428.0,
          12800913.799999999,
          14934399.599999998,
          17067885.4,
          19201371.2,
          21334857.0
        ],
        "counts": [
          27286505,
          10210754,
          6721790,
          4190103,
          3026252,
          2309727,
          1641486,
          944607,
          629546,
          509455
        ]
      },
      "dtype": "int32"
    },
    "Tags": {
      "null_count": 34790855,
      "length_min": 1,
      "length_max": 6,
      "length_mean": 2.9698918367780447,
      "dtype": "list<string>"
    }
  }
}
