{
  "schema_version": 1,
  "slug": "goodbooks-10k",
  "row_count": 5976479,
  "parquet_sha256": "3055650ee4a90c9cbdc2730d9ad528829048e3c53f00457acd55de4495f19373",
  "computed_at": "2026-05-16T08:55:07Z",
  "sample_rows": null,
  "columns": {
    "user_id": {
      "null_count": 0,
      "min": 1,
      "max": 53424,
      "mean": 26224.457362102334,
      "ndv_approx": 49855,
      "histogram": {
        "buckets": [
          1.0,
          5343.3,
          10685.6,
          16027.900000000001,
          21370.2,
          26712.5,
          32054.800000000003,
          37397.1,
          42739.4,
          48081.700000000004,
          53424.0
        ],
        "counts": [
          622812,
          626277,
          612250,
          609185,
          605685,
          590529,
          583887,
          582047,
          570759,
          573048
        ]
      },
      "dtype": "uint16"
    },
    "book_id": {
      "null_count": 0,
      "min": 1,
      "max": 10000,
      "mean": 2006.4773984816143,
      "ndv_approx": 8565,
      "histogram": {
        "buckets": [
          1.0,
          1000.9,
          2000.8,
          3000.7,
          4000.6,
          5000.5,
          6000.4,
          7000.3,
          8000.2,
          9000.1,
          10000.0
        ],
        "counts": [
          3134783,
          846531,
          514292,
          365667,
          276269,
          228069,
          189091,
          160518,
          139971,
          121288
        ]
      },
      "dtype": "uint16"
    },
    "rating": {
      "null_count": 0,
      "min": 1,
      "max": 5,
      "mean": 3.9198655261735214,
      "ndv_approx": 5,
      "histogram": {
        "buckets": [
          1.0,
          1.4,
          1.8,
          2.2,
          2.6,
          3.0,
          3.4000000000000004,
          3.8000000000000003,
          4.2,
          4.6,
          5.0
        ],
        "counts": [
          124195,
          0,
          359257,
          0,
          0,
          1370916,
          0,
          2139018,
          0,
          1983093
        ]
      },
      "dtype": "uint8"
    }
  }
}
