{
  "schema_version": 1,
  "slug": "uci-auto-mpg",
  "row_count": 398,
  "parquet_sha256": "82480fcf2dfdbe04c570c309ef9939cba04b81df4ae26e695acabe76aec9314e",
  "computed_at": "2026-05-16T10:21:46Z",
  "sample_rows": null,
  "columns": {
    "car_name": {
      "null_count": 0,
      "ndv_approx": 293,
      "mean_length": 16.09547738693467,
      "top_values": null,
      "dtype": "string"
    },
    "cylinders": {
      "null_count": 0,
      "min": 3,
      "max": 8,
      "mean": 5.454773869346734,
      "ndv_approx": 5,
      "histogram": {
        "buckets": [
          3.0,
          3.5,
          4.0,
          4.5,
          5.0,
          5.5,
          6.0,
          6.5,
          7.0,
          7.5,
          8.0
        ],
        "counts": [
          4,
          0,
          204,
          0,
          3,
          0,
          84,
          0,
          0,
          103
        ]
      },
      "dtype": "uint8"
    },
    "displacement": {
      "null_count": 0,
      "min": 68.0,
      "max": 455.0,
      "mean": 193.42587939698493,
      "ndv_approx": 96,
      "histogram": {
        "buckets": [
          68.0,
          106.7,
          145.4,
          184.10000000000002,
          222.8,
          261.5,
          300.20000000000005,
          338.90000000000003,
          377.6,
          416.3,
          455.0
        ],
        "counts": [
          107,
          89,
          31,
          13,
          57,
          3,
          42,
          31,
          16,
          9
        ]
      },
      "dtype": "float64"
    },
    "horsepower": {
      "null_count": 6,
      "min": 46,
      "max": 230,
      "mean": 104.46938775510205,
      "ndv_approx": 108,
      "histogram": {
        "buckets": [
          46.0,
          64.4,
          82.8,
          101.19999999999999,
          119.6,
          138.0,
          156.39999999999998,
          174.79999999999998,
          193.2,
          211.6,
          230.0
        ],
        "counts": [
          27,
          95,
          120,
          44,
          19,
          47,
          13,
          14,
          5,
          8
        ]
      },
      "dtype": "uint8"
    },
    "weight": {
      "null_count": 0,
      "min": 1613,
      "max": 5140,
      "mean": 2970.424623115578,
      "ndv_approx": 407,
      "histogram": {
        "buckets": [
          1613.0,
          1965.7,
          2318.4,
          2671.1,
          3023.8,
          3376.5,
          3729.2,
          4081.9,
          4434.6,
          4787.299999999999,
          5140.0
        ],
        "counts": [
          31,
          90,
          59,
          54,
          37,
          40,
          29,
          34,
          18,
          6
        ]
      },
      "dtype": "uint16"
    },
    "acceleration": {
      "null_count": 0,
      "min": 8.0,
      "max": 24.8,
      "mean": 15.568090452261291,
      "ndv_approx": 110,
      "histogram": {
        "buckets": [
          8.0,
          9.68,
          11.36,
          13.040000000000001,
          14.72,
          16.4,
          18.080000000000002,
          19.76,
          21.44,
          23.12,
          24.8
        ],
        "counts": [
          6,
          15,
          50,
          86,
          101,
          71,
          45,
          13,
          7,
          4
        ]
      },
      "dtype": "float64"
    },
    "model_year": {
      "null_count": 0,
      "min": 70,
      "max": 82,
      "mean": 76.01005025125629,
      "ndv_approx": 14,
      "histogram": {
        "buckets": [
          70.0,
          71.2,
          72.4,
          73.6,
          74.8,
          76.0,
          77.2,
          78.4,
          79.6,
          80.8,
          82.0
        ],
        "counts": [
          57,
          28,
          40,
          27,
          30,
          62,
          36,
          29,
          29,
          60
        ]
      },
      "dtype": "uint8"
    },
    "origin": {
      "null_count": 0,
      "min": 1,
      "max": 3,
      "mean": 1.5728643216080402,
      "ndv_approx": 3,
      "histogram": {
        "buckets": [
          1.0,
          1.2,
          1.4,
          1.6,
          1.8,
          2.0,
          2.2,
          2.4000000000000004,
          2.6,
          2.8,
          3.0
        ],
        "counts": [
          249,
          0,
          0,
          0,
          0,
          70,
          0,
          0,
          0,
          79
        ]
      },
      "dtype": "uint8"
    },
    "mpg": {
      "null_count": 0,
      "min": 9.0,
      "max": 46.6,
      "mean": 23.514572864321615,
      "ndv_approx": 132,
      "histogram": {
        "buckets": [
          9.0,
          12.76,
          16.52,
          20.28,
          24.04,
          27.8,
          31.560000000000002,
          35.32,
          39.08,
          42.84,
          46.6
        ],
        "counts": [
          13,
          78,
          73,
          61,
          54,
          48,
          38,
          22,
          5,
          6
        ]
      },
      "dtype": "float64"
    }
  }
}
